{
  "matrix_id": "VS-LIFECYCLE-12X10",
  "version": "1.7.0",
  "baseline_semantics": "FOCUS / CONSIDER are prompts only, not adoption requirements",
  "concerns": [
    {
      "id": "OUTCOME_VALUE",
      "label": "User value and outcomes",
      "primary_control": "UPS-DOC",
      "reference_ids": [
        "DORA-2026"
      ]
    },
    {
      "id": "USERS_ACCESSIBILITY",
      "label": "Usability, accessibility and support",
      "primary_control": "UPS-CLI",
      "reference_ids": [
        "W3C-WCAG"
      ]
    },
    {
      "id": "RISK_SECURITY",
      "label": "Safety, security and threats",
      "primary_control": "UPS-SEC",
      "reference_ids": [
        "NIST-SSDF",
        "OWASP-SAMM"
      ]
    },
    {
      "id": "ARCHITECTURE_DEPENDENCIES",
      "label": "Architecture, technology and dependencies",
      "primary_control": "UPS-COMP",
      "reference_ids": [
        "MS-ARCH"
      ]
    },
    {
      "id": "DATA_PRIVACY",
      "label": "Data, privacy and retention",
      "primary_control": "UPS-LAYOUT",
      "reference_ids": [
        "NIST-SSDF"
      ]
    },
    {
      "id": "QUALITY_ASSURANCE",
      "label": "Quality and verification",
      "primary_control": "UPS-TEST",
      "reference_ids": [
        "OWASP-SAMM"
      ]
    },
    {
      "id": "RELEASE_SUPPLYCHAIN",
      "label": "Release, supply chain and compatibility",
      "primary_control": "UPS-REL",
      "reference_ids": [
        "SLSA-1.2"
      ]
    },
    {
      "id": "OPERATIONS_RELIABILITY",
      "label": "Operations, reliability and recovery",
      "primary_control": "UPS-OBS",
      "reference_ids": [
        "SRE-ERROR",
        "OTEL"
      ]
    },
    {
      "id": "ECONOMICS_SUSTAINABILITY",
      "label": "Cost, resources and sustainability",
      "primary_control": "UPS-DOC",
      "reference_ids": [
        "FINOPS"
      ]
    },
    {
      "id": "GOVERNANCE_EVIDENCE",
      "label": "Ownership, decisions and evidence",
      "primary_control": "UPS-EVID",
      "reference_ids": [
        "OWASP-SAMM",
        "ADR"
      ]
    }
  ],
  "stages": [
    {
      "id": "DISCOVER",
      "label": "Discover problems and opportunities",
      "objective": "Determine whether a problem is worth solving and describe measurable user outcomes.",
      "minimum_output": "Problem brief + baseline hypothesis",
      "exit_decision": "continue / stop / research further",
      "primary_control": "UPS-DOC",
      "next_stages": [
        "ASSESS"
      ],
      "revisit_stages": [
        "DISCOVER"
      ],
      "reference_ids": [
        "RADAR"
      ],
      "coverage": {
        "OUTCOME_VALUE": "FOCUS",
        "USERS_ACCESSIBILITY": "FOCUS",
        "RISK_SECURITY": "CONSIDER",
        "ARCHITECTURE_DEPENDENCIES": "CONSIDER",
        "DATA_PRIVACY": "CONSIDER",
        "QUALITY_ASSURANCE": "CONSIDER",
        "RELEASE_SUPPLYCHAIN": "CONSIDER",
        "OPERATIONS_RELIABILITY": "CONSIDER",
        "ECONOMICS_SUSTAINABILITY": "FOCUS",
        "GOVERNANCE_EVIDENCE": "CONSIDER"
      }
    },
    {
      "id": "ASSESS",
      "label": "Assess feasibility and alternatives",
      "objective": "Compare build, buy, reuse and no-action options, including operating costs.",
      "minimum_output": "Options and feasibility decision",
      "exit_decision": "build / buy / reuse / no-go",
      "primary_control": "UPS-COMP",
      "next_stages": [
        "INITIATE"
      ],
      "revisit_stages": [
        "DISCOVER"
      ],
      "reference_ids": [
        "MS-ARCH",
        "FINOPS",
        "OPENSSF-SCORECARD"
      ],
      "coverage": {
        "OUTCOME_VALUE": "FOCUS",
        "USERS_ACCESSIBILITY": "CONSIDER",
        "RISK_SECURITY": "FOCUS",
        "ARCHITECTURE_DEPENDENCIES": "FOCUS",
        "DATA_PRIVACY": "CONSIDER",
        "QUALITY_ASSURANCE": "CONSIDER",
        "RELEASE_SUPPLYCHAIN": "CONSIDER",
        "OPERATIONS_RELIABILITY": "CONSIDER",
        "ECONOMICS_SUSTAINABILITY": "FOCUS",
        "GOVERNANCE_EVIDENCE": "CONSIDER"
      }
    },
    {
      "id": "INITIATE",
      "label": "Initiate and assign ownership",
      "objective": "Define outcome owners, scope, risk and acceptance authority.",
      "minimum_output": "Charter + scope + owners + acceptance",
      "exit_decision": "fund / defer / stop",
      "primary_control": "UPS-DOC",
      "next_stages": [
        "SPECIFY"
      ],
      "revisit_stages": [
        "DISCOVER",
        "ASSESS"
      ],
      "reference_ids": [
        "NIST-SSDF",
        "ADR"
      ],
      "coverage": {
        "OUTCOME_VALUE": "FOCUS",
        "USERS_ACCESSIBILITY": "CONSIDER",
        "RISK_SECURITY": "FOCUS",
        "ARCHITECTURE_DEPENDENCIES": "CONSIDER",
        "DATA_PRIVACY": "CONSIDER",
        "QUALITY_ASSURANCE": "CONSIDER",
        "RELEASE_SUPPLYCHAIN": "CONSIDER",
        "OPERATIONS_RELIABILITY": "CONSIDER",
        "ECONOMICS_SUSTAINABILITY": "CONSIDER",
        "GOVERNANCE_EVIDENCE": "FOCUS"
      }
    },
    {
      "id": "SPECIFY",
      "label": "Specify requirements and acceptance",
      "objective": "Describe user, quality, data and security requirements in verifiable form.",
      "minimum_output": "Requirements + acceptance + non-goals",
      "exit_decision": "approve / revise",
      "primary_control": "UPS-TEST",
      "next_stages": [
        "DESIGN"
      ],
      "revisit_stages": [
        "INITIATE"
      ],
      "reference_ids": [
        "W3C-WCAG",
        "OPENAPI"
      ],
      "coverage": {
        "OUTCOME_VALUE": "FOCUS",
        "USERS_ACCESSIBILITY": "FOCUS",
        "RISK_SECURITY": "FOCUS",
        "ARCHITECTURE_DEPENDENCIES": "CONSIDER",
        "DATA_PRIVACY": "FOCUS",
        "QUALITY_ASSURANCE": "FOCUS",
        "RELEASE_SUPPLYCHAIN": "CONSIDER",
        "OPERATIONS_RELIABILITY": "CONSIDER",
        "ECONOMICS_SUSTAINABILITY": "CONSIDER",
        "GOVERNANCE_EVIDENCE": "CONSIDER"
      }
    },
    {
      "id": "DESIGN",
      "label": "Design architecture and controls",
      "objective": "Explore boundaries, alternatives, failure modes, recovery and trade-offs.",
      "minimum_output": "Architecture decision + threat/data model",
      "exit_decision": "freeze for increment / experiment",
      "primary_control": "UPS-COMP",
      "next_stages": [
        "IMPLEMENT"
      ],
      "revisit_stages": [
        "SPECIFY",
        "ASSESS"
      ],
      "reference_ids": [
        "MS-ARCH",
        "MICROSOFT-PATTERNS",
        "ADR"
      ],
      "coverage": {
        "OUTCOME_VALUE": "CONSIDER",
        "USERS_ACCESSIBILITY": "CONSIDER",
        "RISK_SECURITY": "FOCUS",
        "ARCHITECTURE_DEPENDENCIES": "FOCUS",
        "DATA_PRIVACY": "FOCUS",
        "QUALITY_ASSURANCE": "CONSIDER",
        "RELEASE_SUPPLYCHAIN": "CONSIDER",
        "OPERATIONS_RELIABILITY": "FOCUS",
        "ECONOMICS_SUSTAINABILITY": "CONSIDER",
        "GOVERNANCE_EVIDENCE": "CONSIDER"
      }
    },
    {
      "id": "IMPLEMENT",
      "label": "Implement and integrate",
      "objective": "Create minimum maintainable changes with reproducible inputs and reviewable tests.",
      "minimum_output": "Change set + reproducible build input",
      "exit_decision": "ready for independent verification / redo",
      "primary_control": "UPS-TEST",
      "next_stages": [
        "VERIFY"
      ],
      "revisit_stages": [
        "DESIGN"
      ],
      "reference_ids": [
        "GOOGLE-ENG",
        "SLSA-1.2"
      ],
      "coverage": {
        "OUTCOME_VALUE": "CONSIDER",
        "USERS_ACCESSIBILITY": "CONSIDER",
        "RISK_SECURITY": "CONSIDER",
        "ARCHITECTURE_DEPENDENCIES": "FOCUS",
        "DATA_PRIVACY": "CONSIDER",
        "QUALITY_ASSURANCE": "FOCUS",
        "RELEASE_SUPPLYCHAIN": "FOCUS",
        "OPERATIONS_RELIABILITY": "CONSIDER",
        "ECONOMICS_SUSTAINABILITY": "CONSIDER",
        "GOVERNANCE_EVIDENCE": "CONSIDER"
      }
    },
    {
      "id": "VERIFY",
      "label": "Verify and accept",
      "objective": "Test the exact candidate under representative negative, edge, fault, security and compatibility cases.",
      "minimum_output": "Evidence + acceptance decision + known risks",
      "exit_decision": "promote candidate / hold / rework",
      "primary_control": "UPS-TEST",
      "next_stages": [
        "RELEASE"
      ],
      "revisit_stages": [
        "IMPLEMENT",
        "DESIGN"
      ],
      "reference_ids": [
        "OWASP-SAMM",
        "NIST-SSDF",
        "SLSA-1.2"
      ],
      "coverage": {
        "OUTCOME_VALUE": "CONSIDER",
        "USERS_ACCESSIBILITY": "FOCUS",
        "RISK_SECURITY": "FOCUS",
        "ARCHITECTURE_DEPENDENCIES": "CONSIDER",
        "DATA_PRIVACY": "CONSIDER",
        "QUALITY_ASSURANCE": "FOCUS",
        "RELEASE_SUPPLYCHAIN": "CONSIDER",
        "OPERATIONS_RELIABILITY": "CONSIDER",
        "ECONOMICS_SUSTAINABILITY": "CONSIDER",
        "GOVERNANCE_EVIDENCE": "FOCUS"
      }
    },
    {
      "id": "RELEASE",
      "label": "Release and transition",
      "objective": "Deliver the verified candidate with rollback and operator handover.",
      "minimum_output": "Artifact digest + release evidence + runbook",
      "exit_decision": "release / rollback / hold",
      "primary_control": "UPS-REL",
      "next_stages": [
        "OPERATE_SUPPORT"
      ],
      "revisit_stages": [
        "VERIFY"
      ],
      "reference_ids": [
        "SLSA-1.2",
        "SRE-ERROR"
      ],
      "coverage": {
        "OUTCOME_VALUE": "CONSIDER",
        "USERS_ACCESSIBILITY": "CONSIDER",
        "RISK_SECURITY": "CONSIDER",
        "ARCHITECTURE_DEPENDENCIES": "CONSIDER",
        "DATA_PRIVACY": "CONSIDER",
        "QUALITY_ASSURANCE": "CONSIDER",
        "RELEASE_SUPPLYCHAIN": "FOCUS",
        "OPERATIONS_RELIABILITY": "FOCUS",
        "ECONOMICS_SUSTAINABILITY": "CONSIDER",
        "GOVERNANCE_EVIDENCE": "FOCUS"
      }
    },
    {
      "id": "OPERATE_SUPPORT",
      "label": "Operate and support",